id,audio,text
825,audio_00825.wav,மொழி சொல்லித்தரணும்னா பெரிய விஷயமே இல்லை அவங்களுக்கு தெரிந்த மொழி நம்மளுக்கு தெரிஞ்சால் நம்ம சொல்லிக்கொடுக்குலாம் அப்படி இல்லைனா நம்மளுக்கு தெரிஞ்சது அவங்களுக்கு தெரியல அவங்களுக்கு தெரிஞ்சது நம்மளுக்கு தெரியலனா நம்ம ச கைலேயே சைகை பண்ணி சொல்லிக்கொடுத்துக்குலாம் அவ்வளோ தான் பெரிய விஷயம் இல்லை
1118,audio_01118.wav,பெரியசாமி சுபாதமிழ் வெண்பா சைந்தவி ரித்திக்கியாஸ்
1429,audio_01429.wav,ALL OTHER PLEASURES ARE NOT WORTH ITS PAINS AND WHEN THE DAY WAS NOT LONG ENOUGH BUT THE NIGHT TOO MUST BE CONSUMED IN KEEN RECOLLECTIONS WHEN THE HEAD BOILED ALL NIGHT ON THE PILLOW WITH THE GENEROUS DEED IT RESOLVED ON
1912,audio_01912.wav,मैं उस समय पच्चीस साल की थी जब मैंने शादी न करने
542,audio_00542.wav,science not that i had any intention of.
310,audio_00310.wav,YES ADDED JERRY AS IF IT MIGHT BE AN AFTERTHOUGHT AND WHILE YOU'RE ABOUT IT WILL JUST MENTION TO UNCLE FELIX THAT THERE ARE FOUR HUSKY BOYS AROUND WITH CONSIDERABLE TIME TO BURN JUST NOW AND IF HE WANTS ANYBODY TO TAKE THAT TRIP FOR HIM WE MIGHT BE COAXED INTO DOING IT
1176,audio_01176.wav,वो इलाहाबाद हाई कोर्ट की रोक का उल्लंघन करते हुए ठीक उसी
71,audio_00071.wav,YES SIR SAID FISHER LOOK HERE THE MAN THRUST OUT HIS FACE DO YOU SEE THOSE GREY HAIRS IN MY BEARD THE EMBARRASSED FISHER GRINNED IS IT GREY CHALLENGED THE VISITOR WITH A ROAR
1008,audio_01008.wav,WE SENT FOR PRUDENCE AND ALL THREE SET OFF AFTER MARGUERITE HAD GIVEN NANINE ORDERS TO TELL THE DUKE THAT SHE HAD TAKEN ADVANTAGE OF THE FINE DAY
631,audio_00631.wav,भी जाकर राशन ले आता था अब जिसके पास आधार है वो
149,audio_00149.wav,थे और दूसरा था संजय गांधी स्टाइल जहां आप ताक़त और ऊँची
1805,audio_01805.wav,IN SPITE OF ALL WE THINK WE KNOW OF THE ACCELERATIVE VELOCITY OF FALLING BODIES AND HAVE PROPAGATED WHY THE EXOTIC BECOMES THE INDIGENOUS OR FROM THE STRANGEST OF PLACES WE'D EXPECT THE FAMILIAR OR
1897,audio_01897.wav,அப்புறம் கீரை வந்து நிறைய கீரை சாப்பிட்லாம் கீரை சாப்பிட்டா கீரை சாப்பிட்டா வளருவாங்க சிறு கீரையில் நிறைய வகை
1748,audio_01748.wav,WHICH IS VERY DISAGREEABLE DEBTS ARE CONTRACTED ACQUAINTANCES BEGUN ABOUT A GREEN TABLE END BY QUARRELS IN WHICH LIFE OR HONOUR COMES TO GRIEF AND THOUGH ONE MAY BE AN HONEST MAN ONE FINDS ONESELF RUINED BY VERY HONEST MEN
525,audio_00525.wav,i saw the smile on bhabas face.
1698,audio_01698.wav,tomorrow there will be a function.
847,audio_00847.wav,इससे पहले इस जगह को इसुयार कहा जाता था
1591,audio_01591.wav,एक दिन खेलते वक्त गेंद कचरा के पास गिरी
216,audio_00216.wav,इसे ब्रिटिश चैनल के रूप में भी जाना जाता रहा है
306,audio_00306.wav,his physical appearance.
1166,audio_01166.wav,நீச்சல் அடிக்கிறது பேஸிக்காக பார்த்தீங்கன்னா உடம்போட சுறுசுறுப்புக்காகவும் பண்ணுறது அதே நேரத்தில் நம்ம சுவாசிக்கிற
618,audio_00618.wav,VERY YOUNG MINNOWS HAD BEEN CAUGHT UP IN THE LONDON TIMES MARCH SECOND EIGHTEEN FIFTY NINE IS A LETTER FROM MISTER AARON ROBERTS CURATE OF SAINT PETER'S CARMATHON IN THIS LETTER
1534,audio_01534.wav,कोर्ट ने रावलपिंडी की अडियाला जेल प्रमुख को चिट्ठी लिखकर उनकी गिरफ़्तारी
1931,audio_01931.wav,மரம்
605,audio_00605.wav,सरकारी हुई तो कर लेते हैं
450,audio_00450.wav,OF GREAT AND DESERVED REPUTE I THOUGHT I SHOULD FOR ONCE LIKE TO TRACE THE ORIGIN OF ONE OF THESE FABULOUS TALES OUR OWN ACCEPTANCE IS THAT JUSTICE CANNOT BE IN AN INTERMEDIATE EXISTENCE
1898,audio_01898.wav,THE STRONG BENT OF NATURE IS SEEN IN THE PROPORTION WHICH THIS TOPIC OF PERSONAL RELATIONS USURPS IN THE CONVERSATION OF SOCIETY WHAT DO WE WISH TO KNOW OF ANY WORTHY PERSON SO MUCH AS HOW HE HAS SPED IN THE HISTORY OF THIS SENTIMENT
1165,audio_01165.wav,IT WON'T WEIGH HEAVY BUT IF YOU DO NEED IT YOU'LL THANK ME FOR IT BLUFF AND JERRY MAY HAVE CONSIDERED FRANK A BIT TOO OLD WOMANISH MAKING ALL THAT FUSS OVER JUST GOING OFF ON A LITTLE CHASE AFTER A WANDERING MOOSE
1581,audio_01581.wav,i will take him to your place.
1562,audio_01562.wav,IT WAS AS IF THE DRAMA IT THUS CAME TO HIM FOR THE FACT OF A DRAMA THERE WAS NO BLINKING WAS BETWEEN THEM THEM QUITE PREPONDERANTLY WITH MERTON DENSHER RELEGATED TO MERE SPECTATORSHIP A PAYING PLACE IN FRONT AND ONE OF THE MOST EXPENSIVE
1715,audio_01715.wav,இது மதுரை திருநெல்வேலி கோவில்பட்டி அதை சுற்றியுள்ள பகுதியை ஆட்சி செய்வதுமாக நம் வரலாறு சொல்கிறது இவங்க பயன்படுத்திய கொடி என்னனு பார்த்திங்னா சேரன் வில்லம்பு என்ற கொடியையும்
541,audio_00541.wav,நான் அதனால தான் நான் உங்கக்கிட்ட பர்ஸ்டு நான் ஃபர்ஸ்டே உங்கக்கிட்ட நான் அதான் சொன்னேன் நீங்கள் வந்து சீக்கரமாக போக முடியுமா அப்படின்னு நான் உங்கக்கிட்ட எத்தனை தடவை கேட்டேன்
1847,audio_01847.wav,அதனால வந்து கார் வந்து கரெக்டாக இருக்கணும் திரும்பி வரும் போதும் ப்ராப்ளம் வரக்கூடாது போகவும் ப்ராப்ளம் வரக்கூடாது எங்களுக்கு அதனால கார் வந்து ஒரு ஒர்த்தான காராக நல்ல காராக இருக்கணும் நாங்கள் வந்து கேஷ் கொடுத்துடுவோம் கரெக்டாக
761,audio_00761.wav,यह बॉब ईटन द्वारा विकसित किया गया है
630,audio_00630.wav,you will tell everything then.
588,audio_00588.wav,जाओ नहीं माने तो और पीछे पड़ो आख़िर में मान ही जाएगी
280,audio_00280.wav,उन्होंने आचरण की शुद्धता पर बल दिया
871,audio_00871.wav,he picked up the receiver again and started.
255,audio_00255.wav,अगर लोगों ने देख ली तो भारतीय फिल्म उद्योग सत्तर साल पीछे
487,audio_00487.wav,அண்ணா ராஜி மெஸ்ஸுங்களாண்ணா
339,audio_00339.wav,PERHAPS AS A SORT OF FORERUNNER OF THE COMING STORM THERE YOU ARE FELLOWS HE ANNOUNCED ALL STARED HARD AT THE MONSTROUS TRACKS BLUFF EVEN GOT DOWN ON HANDS AND KNEES IN ORDER TO SEE BETTER IT WAS A MOOSE ALL RIGHT FRANK SAID JERRY
957,audio_00957.wav,इस बारे में सोमवार को सिफारिश की थी
1127,audio_01127.wav,चलता है वो बिना संक्रमण के ख़तरे के बच्चे को जन्म दे
240,audio_00240.wav,ग्राहक की मौत पर उनके परिजनों को तीन लाख रुपये का मुआवजा
469,audio_00469.wav,AND I WASN'T THERE LONG EITHER HE POSITIVELY SAW WITH IT THAT NOTHING FOR HIM SO FAR AS SHE WAS CONCERNED WOULD AGAIN BE WRONG SHE'S BEAUTIFUL BUT I DON'T SAY SHE'S EASY TO KNOW
417,audio_00417.wav,நம்மகிட்ட இருக்கிற ஒரு பெரிய சாபம் அவங்க கிட்டே இருக்காது நான் எதை சொல்றேனா நம்ம கிட்டே இருக்க இந்த அலைபேசியை சொல்கிறேன் ஏன்னா நம்ம அலைபேசி இருக்குதா அலைபேசி போதும் இது ஒன்று தான் நம்ம உலகன்னு சொல்லிட்டு நம்ம இஷ்டத்துக்கு இருப்போம்
328,audio_00328.wav,have they ever harassed anyone say.
1792,audio_01792.wav,AS IF NOW TO KEEP WELL WITH HIM HE ASKED NOTHING BETTER SHE WAS OFF WITH YOU TO THESE PARTS BEFORE I KNEW IT I MYSELF WAS OFF TOO AWAY OFF TO WONDERFUL PARTS WHERE I HAD ENDLESSLY MORE TO SEE
1985,audio_01985.wav,அதுதான் ஓடிக்கிட்டு இருக்குது மேக்ஸ் என்ன சொல்வது ஃபிரிட்ஜ் மிக்ஸி இந்த கிரைண்ட்ரு இந்தமாதிரி எக்ஸட்ரா எக்ஸட்ரா எல்லாமே
1391,audio_01391.wav,in the small house at the other end of the compound.
1471,audio_01471.wav,और से नहीं बता सकती थी
1234,audio_01234.wav,bhabaprasad looked at me with curiosity.
511,audio_00511.wav,அப்புறம் களிமண்ணை எடுத்து மண் பானைகள் பொம்மைகள் இதுலாம் போன்ல வந்து செய்யறது
963,audio_00963.wav,யோனோ எஸ்பிஐ வாலெட்டில் நடந்த என் கடந்தகாலப் பரிவர்த்தனைகள் அனைத்தையும் எங்கே பார்க்கலாம்
1180,audio_01180.wav,மில்லு நிறையா ஆகலைனாலும் ஜனம் தடுமாறி போயிடும்
1019,audio_01019.wav,போர் தண்ணி குடிச்சம்னால் இன்னும் இதை சுத்தமானதாக அதை மட்டும் போர் தண்ணியை மட்டும் எடுத்து வடிகட்டி குடிச்சிட்டுடோம்னா அதில வந்து
367,audio_00367.wav,AND THAT HAPPEN WHAT MIGHT SHE WOULD NOT SACRIFICE THE PLEASURE OF HAVING ME CONSTANTLY WITH HER ADDING THAT THOSE WHO WERE NOT SATISFIED WITH THIS ARRANGEMENT WERE FREE TO STAY AWAY SO MUCH I HAD HEARD ONE DAY WHEN PRUDENCE HAD SAID TO MARGUERITE
256,audio_00256.wav,இல்லை ஆட்டாங்கல்லோ அந்த மாதிரி இருந்தால் அதில் தண்ணி இருந்தாலும்
1639,audio_01639.wav,LIKE TWO CHILDREN IN THE DIM ALLEYS OF THE CHAMPS ELYSEES SHE WOULD COME IN TIRED TAKE A LIGHT SUPPER AND GO TO BED AFTER A LITTLE MUSIC OR READING WHICH SHE HAD NEVER BEEN USED TO DO THE COUGH
592,audio_00592.wav,ஈஸியா பிடிச்சிட்லாம் மீன்லாம் நிறையா மாட்டிடும் மீனை வந்து சென்ன மீன் அப்பறம் சிலேப்பித்தான் அதிகமாக மாட்டும் அப்பறம் பெருசாக எந்த மீனும் மாட்டுறது மாட்டாது பெருசாக வச்சு வேறதான் கெண்டை விரால்மீன் இதேமாதிரி மாற்றும்
90,audio_00090.wav,वहाँ से हथियारों का एक डिपो और एक हवाई पट्टी एक हज़ार
714,audio_00714.wav,ने पांच और अन्य ने तीन सीटों पर जीत दर्ज कर ली
295,audio_00295.wav,hey i am not joking.
281,audio_00281.wav,इस बार मोदी ने इतनी सभाएं की हैं कि ये सवाल उठने
490,audio_00490.wav,when and how will you come here.
942,audio_00942.wav,मुखचतुष्कि बंदनमालिका सुंदर है
1620,audio_01620.wav,ஆனால் அந்தளவுக்கு பார்த்திங்கனா அந்த நெட்டுனு சொல்கிறாங்கள இணையத்தளம் ஆ இணையத்தளம் வளர்ச்சி தொழில் நுட்பம் வளர்ச்சி இணையத்தளங்களின் வளர்ச்சி
1643,audio_01643.wav,சிட்னி ஹாங்காங் மாஸ்கோ
853,audio_00853.wav,எப்படி சொல்கிறது வைரமுத்து சாங்ஸு நல்லாயிருக்கும் வாலியோடது நல்லாயிருக்கும் அந்த மாதிரி நிறைய சாங்ஸு நல்லாயிருக்கும் இப்போது புது சாங்ஸில் பெருசாக
1293,audio_01293.wav,இப்போ ஸ்கூல் வந்து ஒரு கட்டாயம் அது வந்து எதோ கல்வி வந்து இலவசம் கல்வி மட்டும் தான் இலவசம் இலவசம் இலவசம் கல்வி தான் கல்வியை பொறுத்த வரைக்கு
183,audio_00183.wav,unfold the mystery i wanted to know the details.
529,audio_00529.wav,THE EVIDENCE OF THE FALL OF FISH ON THIS OCCASION WAS VERY CONCLUSIVE A SPECIMEN OF THE FISH WAS EXHIBITED
479,audio_00479.wav,HAD REALLY NOT MADE IN HER OWN COUNTRY THE MARK SHE HAD CHALKED SO LARGE IN LONDON
1351,audio_01351.wav,इस वाक्य में क्या का उत्तर केला है
1829,audio_01829.wav,WE CAN ONLY GIVE A GUESS AT THAT FRANK TOLD HIM WHEW EXCLAIMED BLUFF AS HE GRASPED THE MEANING BACK OF THOSE FEW WORDS AFTER ALL I WOULDN'T PUT IT PAST HIM FRANK
1896,audio_01896.wav,இதெல்லாம் இருக்கு இந்த இப்போ ரெஜ்ஜியன் ஆஃப் மேரி அப்புறம் அந்த அன்பியங்கள் இது போலலாம் இருக்கு அதிலயெல்லாம் நான் வந்து நிறைய பார்ட்டிசிபேஷன் பண்ணுறேன் அதில் நான் வந்து பொறுப்புலேயுமே இருக்கேன் தலைவராக இருக்கேன்
844,audio_00844.wav,இசை நாடகம் அப்படின்று முப்பெரும் பிரிவுகள் இருக்குது அதாவது தமிழை மூணு வகையாக பிரிக்கலாம் இயல் தமி இயற்றமிழ்
1268,audio_01268.wav,நான் தமிழில் பேசும்பொழுது கண்டிப்பாக நான் சிரமம் வந்து பட்டிருக்கேன் அது என்னென்னா இந்த ழா வராது லா வராது ஏதாவது ஒரு பழக்கடைக்கு போய் நம்ம வந்து வாழைப்பழம் சொன்னால் வாலப்பயம்
1265,audio_01265.wav,ये इनाम उन्हें क्राउन प्रिंस की सुरक्षा में बहादुरी दिखाने के लिए
1117,audio_01117.wav,उनके पिता ऑस्ट्रेलियन हैं और मां फिलीपींस की
1823,audio_01823.wav,FOR IT IS TO BE CONSIDERED THAT THIS PASSION OF WHICH WE SPEAK THOUGH IT BEGIN WITH THE YOUNG YET FORSAKES NOT THE OLD OR RATHER SUFFERS NO ONE WHO IS TRULY ITS SERVANT TO GROW OLD
307,audio_00307.wav,अमरीका जाकर इलाज कराने की सलाह हमने ही दी थी
1963,audio_01963.wav,நாமக்கல் மாவட்டத்தில் வந்து இப்போது ரீசென்ட்டாக வந்து ரெண்டாயிரத்தி இருபத்தி மூனில் டிசெம்பர் மாதத்தில் வைகுண்ட ஏகாதசி
1211,audio_01211.wav,ஒரு பூங்கா இதுவெல்லாம் பண்ணிணா அதிகமாகலாம்
1852,audio_01852.wav,यहीं से इंदिरा गाँधी की राजनीतिक वापसी की शुरुआत हुई
732,audio_00732.wav,बेटा पैदा होने तक मुझे ये सब झेलना ही था
916,audio_00916.wav,THEY SOMETIMES SENT OUT BEAUTIES AND CELEBRITIES WHO LEFT THE BRITON COLD THE BRITON'S TEMPERATURE IN TRUTH WASN'T TO BE CALCULATED A FORMULATION OF THE MATTER THAT WAS NOT REACHED
409,audio_00409.wav,FOR NO YOUNG MAN COULD HAVE BEEN LESS FORMIDABLE THAN THE PERSON TO THE RELIEF OF WHOSE SHYNESS HER NIECE OSTENSIBLY CAME THE OSTENSIBLE IN KATE STRUCK HIM ALTOGETHER ON THIS OCCASION AS PRODIGIOUS
1323,audio_01323.wav,THEN AS IF THERE WERE REAL REASONING THEY MUST HAVE BEEN HIGH TO FALL WITH SUCH DIVERGENCE OR ONE OF THEM MUST HAVE BEEN CARRIED PARTLY HORIZONTALLY EIGHT MILES FARTHER THAN THE OTHER BUT EITHER SUPPOSITION ARGUES FOR POWER MORE THAN THAT OF A LOCAL WHIRL OR GUST
1854,audio_01854.wav,HIS GREAT DREAD VERILY WAS OF BEING ASHAMED WHICH WAS A THING DISTINCT AND IT MATTERED BUT LITTLE THAT HE WAS ASHAMED OF THAT TOO IT WAS OF THE ESSENCE OF HIS POSITION THAT IN SUCH A HOUSE AS THIS THE TABLES COULD ALWAYS BE TURNED ON HIM
555,audio_00555.wav,at what time would you like to have dinner early.
1983,audio_01983.wav,of course his ghost story could in.
1231,audio_01231.wav,water or want me to go to the market.
752,audio_00752.wav,பிடிச்சி மறுபடியும் தண்ணிக்குள்ளே விட்டாலாம் அது செத்து போய்டும் ஏன்னா தூண்டில மாட்டினா மீன் வந்து ரொம்ப நாலு உயிரோடையும் இருக்காது அது கண்டிப்பாக செத்துடும் அதனால சாகுறத நம்ம வந்து வீணாக சாப்பிட்றது நல்லதுன்னு நாங்கள் சாப்பிட்ருவாங்க
701,audio_00701.wav,affection i had heard many nature lovers talk about.
1971,audio_01971.wav,இதெல்லாம் வந்து கவர்மெண்டில் பண்ணிக் கொடுத்த இது எல்லாமே கொஞ்சம் உதவி இதாக நல்லாதான் இருக்குது
1681,audio_01681.wav,A BARN AND A HORSE WERE CARRIED COMPLETELY AWAY AND NEITHER HORSE NOR BARN NOR ANY PORTION OF EITHER HAVE SINCE BEEN FOUND AFTER THAT WHICH WOULD BE A LITTLE STRONG WERE IT NOT FOR A STEADY IMPROVEMENT IN OUR DIGESTIONS THAT I NOTE AS WE GO ALONG
231,audio_00231.wav,வேலை நேரத்தை விட்டு எனக்கு பொழுதுபோக்குனு பார்த்துட்டா எனக்கு பாட்டு கேக்கிறது இந்த பெரும்பாலும் இந்த பாட்டு கேட்டுக்கிட்டே இந்த தூங்குகிற மாதிரி இது
531,audio_00531.wav,ये जानकारी अमरीका के एक वरिष्ठ अधिकारी ने नाम ना बताने की
190,audio_00190.wav,unless he has heard rumours.
1819,audio_01819.wav,के पंद्रह और कांग्रेस के बारह विधायकों का समर्थन है
1988,audio_01988.wav,AS TO DISCUSSION NOT A WORD OR SCIENCE AND ITS CONTINUITY WITH PRESBYTERIANISM DATA LIKE THIS ARE DAMNED AT BIRTH THE WEATHER REVIEW DOES SPRINKLE OR BAPTIZE OR ATTEMPT TO SAVE THIS INFANT
1050,audio_01050.wav,சுலபமாக பதியும் வகையில்
1281,audio_01281.wav,ஒரு ஒரு ரெண்டு ஏக்கரை கடலை போட்டாலும் அதை வந்து நாங்கள் க பருப்பு வாங்கி கடலை போட்டு
1363,audio_01363.wav,முன்னோக்கி
390,audio_00390.wav,விபத்துக்கு ஆளாக வேண்டிய சூழ்நிலைக்கு ஆளாகுவோம் நாம் பாதுகாப்பாக போகிறது வந்து ரொம்ப கஷ்டமாக இருக்கும் ரோடு வந்து இப்போ இருக்கிற ரோடெல்லாம் ரொம்ப மோசமாக இருக்கு
66,audio_00066.wav,அதெல்லாம் இறைச்சி ஊற்றி கிளீனாக காயவச்சு மூ மூடி வச்சுடுவேன் வேறு பேஷன் அந்த மாதிரி பேரல் அந்த மாதிரி தண்ணி இருந்தாலும் தேவைங்கிற தண்ணியை மட்டும் எடுத்துக்கிட்டு தேவையில்லையினால் எல்லாம் ஊற்றி கிளீன் பண்ணிவிட்டு அதையும் வந்து சுத்தம் பண்ணி வச்சுடுவேன்
1899,audio_01899.wav,JUST THE THOUGHT OF IT GIVES ME A WARM FEELING AROUND MY HEART SAME HERE BLUFF TOLD HIM CHEERFULLY I NEVER FEEL HAPPIER THAN WHEN I SMELL THE WOODS AND GET ON THE TRAIL OF GAME
805,audio_00805.wav,it didnt take me long to understand the.
1658,audio_01658.wav,did he twist his tongue when he.
1671,audio_01671.wav,stone ships left i knew that bhabaprasad wanted to let me.
1432,audio_01432.wav,நாமக்கல் ஈரோடு கோவை மெட்ராஸ் கரூர்
1254,audio_01254.wav,i had brought some warm clothes with me.
1832,audio_01832.wav,லைசன்ஸ் அவங்க அவங்களுக்கு ஒரு லைசன்ஸ் கொடுக்கணும்
1704,audio_01704.wav,यह हमारे समय की सबसे अद्भुत खोजों में से एक है
1958,audio_01958.wav,OF A FALL OF TADPOLES FROM THE SKY AS TO THERE IN THE FIRST PLACE
1284,audio_01284.wav,senior reporter of an old and reputed daily of guwahati.
1726,audio_01726.wav,once dharani the faith healer had brought him.
3,audio_00003.wav,maybe he was not at home.
275,audio_00275.wav,THE WATCHFUL MANAGER WAS IN THE DEPTHS OF A BOX AND THE POOR ACTRESS IN THE GLARE OF THE FOOTLIGHTS BUT SHE PASSED THE POOR PERFORMER HE COULD SEE HOW SHE ALWAYS PASSED HER WIG HER PAINT HER JEWELS EVERY MARK OF HER EXPRESSION IMPECCABLE
1880,audio_01880.wav,கோழி எரு ஆட்டாம்புழுக்கை இது எல்லாம்தான் இயற்கை உரமாக இருக்குது
278,audio_00278.wav,hearing my voice had seemed like a dream to you.
268,audio_00268.wav,के बारे में जब कहीं का कहीं एक्टिंग के मामले में उनको
921,audio_00921.wav,EVERY PROMISE OF THE SOUL HAS INNUMERABLE FULFILMENTS EACH OF ITS JOYS RIPENS INTO A NEW WANT NATURE UNCONTAINABLE FLOWING FORELOOKING
509,audio_00509.wav,SHE WAS PERFECTLY KIND TO SUSIE IT WAS AS IF SHE POSITIVELY KNEW HER AS HANDICAPPED FOR ANY DISAGREEMENT BY FEELING THAT SHE KATE HAD TYPE AND BY BEING COMMITTED TO ADMIRATION OF TYPE
184,audio_00184.wav,வோடாஃபோன் யூஸ் பண்ணுறாங்க ஆனால் மேஜராக வந்துட்டு அதிகமாக யூஸ் பண்ணுறது எதுன்னால் நிறையா மோஸ்ட் ஆஃப் பீப் மோஸ்ட் ஆஃப் பீப்புள் வந்து
