id,audio,text
420,audio_00420.wav,ये व्यापार लगभग पांच अरब डॉलर सालाना का है जबकि क्षमता इससे
62,audio_00062.wav,रहेंगे लेकिन कुछ ही दिनों बाद उनके डॉक्टर ने उन्हें बताया कि
1496,audio_01496.wav,AND THAT HE WILL NEVER FORGIVE THAT LET MARGUERITE LEAVE THE YOUNG MAN HE SAID TO ME AND AS IN THE PAST I WILL GIVE HER ALL THAT SHE REQUIRES IF NOT LET HER ASK NOTHING MORE FROM ME
1699,audio_01699.wav,THAT WITH SUCH STUFF AS THE STRANGE ENGLISH GIRL WAS MADE OF STUFF THAT IN SPITE OF MAUD MANNINGHAM WHO WAS FULL OF SENTIMENT SHE HAD NEVER KNOWN THERE WAS NONE OTHER TO BE EMPLOYED THESE THINGS WERE OF LATER EVIDENCE
845,audio_00845.wav,குப்பைகள்லாம் சுத்தம் செய்கிறது காலையில் ஏழு மணிக்கே வந்து சுத்தம் செஞ்சிடறாங்க இதனாலே வந்து
965,audio_00965.wav,THE OTHER INSTANCES SEEM TO ME TO BE TYPICAL OF SOMETHING LIKE MIGRATION THEIR GREAT NUMBERS AND THEIR HOMOGENEITY OVER AND OVER IN THESE ANNALS OF THE DAMNED OCCURS THE DATUM OF SEGREGATION
396,audio_00396.wav,அதற்கு தகுந்த மாதிரி தன்னை மாற்றிக் கொண்டுக்கிட்டு இருக்கிறான் வாழ்ந்துக் கிட்டு இருக்கிறான்
387,audio_00387.wav,வண்டியில் போறதனால இன்னும் சுற்றுசூழல் இது சேதப்படுது இருந்தாலும் எங்களுக்கு கொஞ்சம் தேவைப்படுதுனால நாங்கள் வண்டியியில் போகணுமா இருக்குது அந்த உடைய மாசு இதெல்லாம் இருக்கு இதாக தான் வருது இது கீழே அந்த பெட்ரோல் ஊற்றி இருந்தால் கூட செடி கொடி கூடக்கு முளைக்காது ஏன்னா என்ன எங்களுக்கு அது தேவைப்பட்றதுனால நாங்கள் வண்டியில் போகிறோம் சூழ்நெலை எங்களுக்கு இருக்கு
1800,audio_01800.wav,दुनिया में कहीं और नहीं भेज सकते थे
834,audio_00834.wav,MORADABAD INDIA JULY TWENTIETH EIGHTEEN TWENTY NINE
1653,audio_01653.wav,लड़ी थी लेकिन इस साल नहीं लड़ रही हूं क्योंकि यह मेरी
1582,audio_01582.wav,इसकी गुरुभक्ति असामान्य थी
1826,audio_01826.wav,நம்ம ஆவாரம்பூன்னு சொல்லுவாங்க ஆவாரம்பூ எனக்கு ரொம்ப பிடிக்கி ஆவாரம்பூ சாப்பிட்டால் உடம்புக்கு வந்து நல்ல விஷயம் ஆனால் உடல் ரீதியான விஷயம் நல்ல ஆவாரம்பூவுக்கு நல்ல ஒரு மணமும் உண்டு நம்ம மனிதனை மாற்ற ஒரு
1595,audio_01595.wav,கருத்தில் வச்சு செடிகள் பராமரிக்கிறதோ செடிகள் வளர்க்குறதோ பண்ணணும் இது எல்லாத்தேயும் நம்ம யாருக்கிட்ட இருந்து கற்றுக்கலாம் அப்படின்னா விவசாயிகள்கிட்ட இருந்து இதை நல்லா கற்றுக்கலாம்
271,audio_00271.wav,YES AN EXCELLENT IDEA I STAMMERED NOT KNOWING WHAT I WAS SAYING WELL I WILL ARRANGE THAT SAID MARGUERITE FREEING MY HAND AND INTERPRETING MY WORDS ACCORDING TO HER OWN DESIRE
377,audio_00377.wav,அதுலையும் போலியான டாக்டர்ஸ் சும்மா நர்சிங் முடிச்சிட்டு வந்து உக்காஞ்சி பார்க்குறவுங்க தான் அதனாலயே பல இடங்களில் பல விஷயங்கள் நடக்குது
287,audio_00287.wav,hello yes prabal phukan speaking.
1120,audio_01120.wav,பலபேர் படிப்பறிவு இல்லைன்னாலும் அவர்னஸ் மூலயமா தெரிஞ்சுக்க விரும்பணும் அதாவுது போயிட்டு சொல்லணும் இந்தமாதிரிதான் இருக்காங்க அங்கங்கே உள்ள உள்ள சின்ன சின்ன கவுர்மண்ட் ஹாஸ்ப்பிட்டல்ஸ் அங்கே வேலை செய்யிறவங்க இல்லை வாலன்ட்டரிஸ்
818,audio_00818.wav,his unfinished story.
1478,audio_01478.wav,by now understood that visitors came to the bungalow.
808,audio_00808.wav,his feet remain a foot above the.
597,audio_00597.wav,वहीं मर्दों के पसंदीदा समय यानी चौबीस दिसंबर की तारीख के लिए
1133,audio_01133.wav,out of bhabaprasads mouth without any emotion or excitement.
393,audio_00393.wav,हीरोइन नहीं थीं उनके प्रोजेक्ट्स पेंडिंग नहीं थे इसलिए किसी फिल्म को
374,audio_00374.wav,भारतीय अंतरिक्ष अनुसंधान संस्थान इसरो के मुताबिक़ जीसैट ग्यारह का वज़न पांच
478,audio_00478.wav,அப்புறம் வந்து நம்ம தமிழ் இண்டஸ்ட்ரிலேயே இருக்காங்க இளைய தளபதி விஜய் அப்புறம்
1169,audio_01169.wav,பிஎம் போஸன் திட்டத்தில் வந்து சத்துணவு திட்டம் இது இதில் வந்து குழந்தைங்கள்லா வந்து எல்லாருமே வந்து சூப்பராக
558,audio_00558.wav,WE TAKE IT ALL BACK JERRY VOWED AFTER THIS WE'LL OWN UP THAT YOU KNOW A BULL MOOSE FROM A MULE OR A BUCK DEER EVERY TIME THAT'S GOING TO BE A PRIZE PICTURE ALL RIGHT THOSE LAST WORDS FROM FRANK MADE WILL VERY PROUD
917,audio_00917.wav,HE'S THE ONLY PARTY AROUND THAT WE KNOW OF WHO WOULD BE MEAN ENOUGH TO TRY TO SET BUILDINGS ON FIRE JUST TO GET EVEN WITH A MAN HE DISLIKED HE OBSERVED
1016,audio_01016.wav,मुझे एक ख़त लिखा
206,audio_00206.wav,BUT I SNAPPED HIM BEFORE HE TURNED AND TROTTED OFF WHAT TROTTED OFF SHRILLED BLUFF
1914,audio_01914.wav,like you with open arms.
158,audio_00158.wav,संयुक्त राष्ट्र के मुताबिक़ पिछले साल सऊदी अरब में एक
1778,audio_01778.wav,हिस्सा रहे युवक सुमित की गोली लगने से मौत हो गई थी
522,audio_00522.wav,THERE IS A MAGNIFICENT VIEW FROM THE GARDEN WHICH IS AT THE HEIGHT OF AN ORDINARY FIRST FLOOR ON THE LEFT THE AQUEDUCT OF MARLY CLOSES IN THE HORIZON
1651,audio_01651.wav,dont worry about that.
182,audio_00182.wav,WHAT I WANT OF YOU DON'T YOU SEE IS TO BE JUST EXACTLY AS I AM THE QUANTITY OF THE ARTICLE REQUIRED WAS WHAT MIGHT ESPECIALLY HAVE CAUSED HIM TO STAGGER HE LIKED SO IN GENERAL THE QUANTITIES IN WHICH MISSUS LOWDER DEALT
637,audio_00637.wav,जिसमें उनका अहम योगदान माना जाता है
1788,audio_01788.wav,समझौतों से दूर रहने वाली
1390,audio_01390.wav,ONE MUST NOT BE TOO OLD THE DELICIOUS FANCIES OF YOUTH REJECT THE LEAST SAVOR OF A MATURE PHILOSOPHY AS CHILLING WITH AGE AND PEDANTRY THEIR PURPLE BLOOM
1486,audio_01486.wav,இந்த மாதிரி பருவநிலை மாற்றத்தை நம்ம
1353,audio_01353.wav,इसके बावजूद मुझे हमेशा अकेलापन महसूस होता था
1909,audio_01909.wav,THE PLACE HOWEVER MUFFLED IN CONVENIENCE AND DECORUM CONSTANTLY HUMMED FOR HIM WITH THAT THICK IRONY
1751,audio_01751.wav,HIGH AND FIXED THIS ESTIMATE RULED ON EACH OCCASION AT LANCASTER GATE THE SOCIAL SCENE SO THAT HE NOW RECOGNISED IN IT SOMETHING LIKE THE ARTISTIC IDEA THE PLASTIC SUBSTANCE IMPOSED BY TRADITION BY GENIUS BY CRITICISM
979,audio_00979.wav,कभी कभी मुझे डर लगता कि कहीं किसी दिन वो लौट आए
1074,audio_01074.wav,मैंने कहा हो जाएगा
161,audio_00161.wav,about a furlong or so away and spend the night there.
568,audio_00568.wav,WHY COULDN'T I HAVE TAKEN A NOTION TO STEP OUT HERE WITH WILL TO WATCH THE WAY HE TOOK THE PICTURES OF THAT SQUIRREL FAMILY I'D HAVE HAD MY GUN ACROSS MY KNEES WITH BUCKSHOT IN EVERY SHELL OF COURSE THINK HOW
28,audio_00028.wav,எங்கள் ஊர் பக்கத்தில் வந்து ஒரு மில்லு இருக்கு சாரதா மில் அப்படின்னு ஒரு நிறுவனத்தை வந்து ரன் பண்ணிகிட்டு வராங்க
125,audio_00125.wav,IT MIGHT MOVE AMERICAN NERVES HE HAD ONLY HEARD OF THEM BEFORE BUT IN HIS RECENT TOUR HE HAD CAUGHT THEM IN THE REMARKABLE FACT AND THERE WAS NOW A MOMENT OR TWO WHEN IT CAME TO HIM THAT HE HAD PERHAPS AND NOT IN THE WAY OF AN ESCAPE
712,audio_00712.wav,prabal started at the phone for a long time.
1555,audio_01555.wav,MARGUERITE WAS NO LONGER THE SAME WOMAN THAT I HAD KNOWN SHE AVOIDED EVERYTHING THAT MIGHT RECALL TO ME THE LIFE WHICH SHE HAD BEEN LEADING WHEN I FIRST MET HER NEVER DID WIFE OR SISTER SURROUND HUSBAND OR BROTHER WITH SUCH LOVING CARE AS SHE HAD FOR ME
1545,audio_01545.wav,इसमें मुंह के ज़रिए हवा भी पहुंचाई जाती है
372,audio_00372.wav,मोशे के नाना कहते हैं अगर सैंड्रा ने दिलेरी ना दिखाई होती
683,audio_00683.wav,वह साधारण बॉडी एक्शन को भी काफ़ी तोड़ते मरोड़ते हैं और उसको
1989,audio_01989.wav,you will be happy living in our home.
1701,audio_01701.wav,still we always agreed to disagree.
1379,audio_01379.wav,isolated place and even if anyone came.
738,audio_00738.wav,AS OCEAN CURRENTS THE HUDDLED HERD HAD DRIFTED TO HER BLINDLY IT MIGHT AS BLINDLY HAVE DRIFTED AWAY
750,audio_00750.wav,சொல்லி இருக்காங்க நிறைய பேர் இருந்தாலும் வந்து இனம் மற்றும் மொழிகள் குழுக்கள்லால் அவங்க வந்து பிரிஞ்சு தான் இருக்காங்க நிறைய விஷயத்துனால
986,audio_00986.wav,he stopped talking and went out of.
495,audio_00495.wav,HE WALKS WITH ARMS AKIMBO HE SOLILOQUIZES HE ACCOSTS THE GRASS AND THE TREES HE FEELS THE BLOOD OF THE VIOLET THE CLOVER AND THE LILY IN HIS VEINS AND HE TALKS WITH THE BROOK THAT WETS HIS FOOT
222,audio_00222.wav,में क्रांतिकारी बदलाव लाना चाहती हैं
48,audio_00048.wav,நல்லதாக இருக்குதுதான்னு அதை செக்கப் பண்ணுறக்கான ஒரு தனி தனிப் படையும் இருக்கணும்
1811,audio_01811.wav,वे एक सियाल पंजाबी हैं
93,audio_00093.wav,AND WHAT FASTENS ATTENTION IN THE INTERCOURSE OF LIFE LIKE ANY PASSAGE BETRAYING AFFECTION BETWEEN TWO PARTIES PERHAPS WE NEVER SAW THEM BEFORE AND NEVER SHALL MEET THEM AGAIN BUT WE SEE THEM EXCHANGE A GLANCE OR BETRAY A DEEP EMOTION AND WE ARE NO LONGER STRANGERS
786,audio_00786.wav,है इसके बारे में किसी को कुछ पता नहीं चल रहा था
564,audio_00564.wav,AND WE SHALL HAVE EVERYTHING PERFECT THE DUKE IS GOING TO LOOK AFTER EVERY SINGLE THING AH MY DEAR SHE ADDED KISSING ME YOU'RE IN LUCK IT'S A MILLIONAIRE WHO MAKES YOUR BED FOR YOU
1404,audio_01404.wav,I HAVE A GREAT MANY NOTES UPON THE FALL OF FISHES DESPITE THE DIFFICULTY THESE RECORDS HAVE IN GETTING THEMSELVES PUBLISHED BUT I PICK OUT THE INSTANCES THAT ESPECIALLY RELATE TO OUR SUPER GEOGRAPHICAL ACCEPTANCES
224,audio_00224.wav,அவங்கள வந்து வெளிய கொண்டு வரணும் அவங்களோட உணர்ச்சிகளை எப்படி வெளிப்படுத்தணும் அப்டின்றதை வந்து சொல்கிறது இயற்றமிழ் இசைத்தமிழ் வந்து பார்த்தீங்க அப்டின்னா இந்த குறிஞ்சிப்பாட்டு முல்லைப்பாட்டு செய்யுள்
879,audio_00879.wav,जुड़े मिथकों को बताया जाना ज़रूरी है
1076,audio_01076.wav,THAT TEN MINUTES LATER ANOTHER FALL OF FISHES OCCURRED UPON THIS SAME NARROW STRIP OF LAND EVEN ARGUING THAT A WHIRLWIND MAY STAND STILL AXIALLY IT DISCHARGES TANGENTIALLY WHEREVER THE FISHES CAME FROM IT DOES NOT SEEM THINKABLE
1529,audio_01529.wav,अगर मैं ऐसे सवालों का जवाब ग़ुस्से में देता हूं तो तुरंत
97,audio_00097.wav,IN THE FIRST SENTIMENT OF KINDNESS ANTICIPATES ALREADY A BENEVOLENCE WHICH SHALL LOSE ALL PARTICULAR REGARDS IN ITS GENERAL LIGHT THE INTRODUCTION TO THIS FELICITY IS IN A PRIVATE AND TENDER RELATION OF ONE TO ONE WHICH IS THE ENCHANTMENT OF HUMAN LIFE
968,audio_00968.wav,வீடுகளெலாம் கட்டிக் கொடுத்து எல்லாம் நீட்டாக இது பண்ணியிருக்குறாங்க இப்போ அதன் மூலயமாவே நம்ப நம்ப ஊரில் நிறைய பேர் பயனுற்று இப்போ எல்லாமே தார்ஷாட் வீடுதான் போட்டு எல்லாம் இது பண்ணி இருக்கிறாங்க
1578,audio_01578.wav,के कार्यकर्ता भी तो हैं
580,audio_00580.wav,ஏழு அஞ்சு ஜீரோ ஆறு அஞ்சு ஒன்று ரெண்டு ஜீரோ நாலு ரெண்டு ஒன்பது என்ற தொலைபேசி எண்ணுக்கு என்எஸ்பியில் சமர்ப்பிக்கப்பட்ட புது உதவித்தொகை விண்ணப்பங்களின் முழுப் பட்டியலையும் தர முடியுமா
1622,audio_01622.wav,STEWED RABBIT AND ALL THE REST OF THE TRADITIONAL LUNCH IN THE COUNTRY WE HAD NOW ONLY TO DECIDE WHERE WE SHOULD GO IT WAS ONCE MORE PRUDENCE WHO SETTLED THE DIFFICULTY DO YOU WANT TO GO TO THE REAL COUNTRY SHE ASKED YES
651,audio_00651.wav,चार साल बाद मुझे एक बड़ा फ़ैसला करना था
1345,audio_01345.wav,उसकी स्कूली शिक्षा शुरू कर दी है
858,audio_00858.wav,கிராமத்துலேயும் கிளப்பு வந்து வேறு கிராமத்தில் வந்து எப்படி நம்ம வந்து வாழ்க்கையில் முன்னேறலாம் அப்படிங்கிற மாதிரி ஒரு கூட்டம்லாம் போடுவாங்க
1204,audio_01204.wav,FERIDPOOR INDIA FEBRUARY NINETEENTH EIGHTEEN THIRTY
403,audio_00403.wav,அதில் வந்து குழந்தைங்களுக்கு வந்து நல்லா ஆரோக்கியமாக இருக்கிறாங்க சாப்பிட்டு இந்த திட்டத்தில் வந்து குழந்தைங்களுக்கு வந்து ஏழை குழந்தைகள் வந்து மிகவும் பயனடைகிறாங்க பிஎம் போஸன் திட்டம் வந்து ரொம்ப நல்ல திட்டம்
572,audio_00572.wav,mr gogoi was a cheerful person.
239,audio_00239.wav,तितली में ग्रामीण जीवन के सुधार के संकेत हैं
1937,audio_01937.wav,where a deer.
376,audio_00376.wav,कहते हैं अभी वो छोटा है
152,audio_00152.wav,என் எல்லைல வேகமாக ஓடி ஒருத்த யாராவது ஒருத்தவங்க நிற்பாங்க அவங்கள பிடிச்சி தர தர தர தரன்னு இழுத்துரு போய் குறி சொல்லுவாங்க குறி சொல்லிட்டு
1752,audio_01752.wav,விவசாயி விட கூடாது விவசாயத்தை விட கூடாதுங்குறதுக்கோசரம் நாங்கள் விவசாயம் பண்ணிக்கிட்டு இருக்கிறோம் எதுவுமே விவசாயம் ஒரு கவர்மெண்டுலேயோ கவர்மெண்டில் கூட விவசாயிக்கு எந்த லாபமுமே கிடையாது ஒரு பயிர் போனால் கூட அதுக்கு உண்டான வந்து மானியத்தை வந்து விவசாயிக்கு கொடுக்க மாட்டேங்கிறாங்க
1317,audio_01317.wav,हकीम ने बताया हमलोग यहां देढ़ साल से रह रहे हैं
276,audio_00276.wav,BUT HAS ALWAYS SOUGHT POSITIVELY TO PROVE OR TO DISPROVE SOMETHING THAT WAS CONCEIVED OF OR SUSPECTED IN ADVANCE AS I SUSPECTED SAYS THIS CORRESPONDENT I FOUND THAT THE SNAILS WERE OF A FAMILIAR LAND SPECIES THAT THEY HAD BEEN UPON THE GROUND
1084,audio_01084.wav,BUT THERE IS SOME QUESTION OF SPECIES I THINK MYSELF THAT THEY WERE MINNOWS AND STICKLEBACKS SOME PERSONS THINKING THEM TO BE SEA FISHES PLACED THEM IN SALT WATER ACCORDING TO MISTER ROBERTS
1475,audio_01475.wav,acquiring a thorough knowledge of the lifestyle of the.
1506,audio_01506.wav,I'M DONE EATING ANNOUNCED BLUFF COULDN'T CRAM ANOTHER BITE DOWN AFTER SEEING THAT PICTURE JERRY PROCLAIMED AS HE DARTED OVER TO THE CORNER WHERE HIS RIFLE STOOD AND BEGAN TO BUCKLE ON THE WEBBED BELT FILLED WITH CARTRIDGES
665,audio_00665.wav,அவங்களுக்கு வந்து அன்குவாலிட்டியாக இருக்கலாம் ஆனால் பணம் காசு இல்லாமல் நடுத்தரமாக இருக்கிறவங்களுக்கு எல்லாமே கவர்மெண்ட்டு நம்மளுக்கு பண்ணத்தில்
1859,audio_01859.wav,sandals made on the steps.
466,audio_00466.wav,guess that it would not be wise to move.
964,audio_00964.wav,செல்லப்பிராணி உணவுப் பொருட்களுக்கு உள்ள பண்டிகைக் காலச் சலுகையை காட்டவும்
1981,audio_01981.wav,that was natural because unless.
445,audio_00445.wav,TO TREAT HIM AS HARMLESS AND BLAMELESS SHE WAS SO ENGAGED WITH THE FURTHER AID OF A COMPLETE ABSENCE OF ALLUSIONS WHEN THE HIGHEST EFFECT WAS GIVEN HER METHOD BY THE BEAUTIFUL ENTRANCE OF KATE THE METHOD THEREFORE RECEIVED SUPPORT ALL ROUND
868,audio_00868.wav,IT WAS AT THIS TIME THAT SHE READ MANON LESCAUT OVER AND OVER AGAIN I FOUND HER SEVERAL TIMES MAKING NOTES IN THE BOOK AND SHE ALWAYS DECLARED THAT WHEN A WOMAN LOVES SHE CAN NOT DO AS MANON DID
1824,audio_01824.wav,even before you mentioned it.
1904,audio_01904.wav,पिछले तीन चुनावों में किसी कांग्रेसी नेता ने चुनावी मुहिम के दौरान
1612,audio_01612.wav,LEIRUS GASTEROSTEUS IS THE STICKLEBACK ALTOGETHER I THINK WE HAVE NOT A SENSE OF TOTAL PERDITION
829,audio_00829.wav,SAID SHE TURNING TO PRUDENCE AND SPEAKING IN A BROKEN VOICE YOU CAN REPORT THIS SCENE TO THE DUKE AND YOU CAN ADD THAT WE HAVE NO LONGER NEED OF HIM FROM THAT DAY FORTH THE DUKE WAS NEVER REFERRED TO
1418,audio_01418.wav,mental and physical faculties.
994,audio_00994.wav,தூத்துக்குடி திருநெல்வேலி கன்னியாகுமரி சென்னை நீலகிரி
345,audio_00345.wav,after all they too understand love and.
1092,audio_01092.wav,मामला बहस का विषय रहेगा
156,audio_00156.wav,TAKEN A LESSON FROM THEM THEY QUIVERED CLEARLY THEY HUMMED AND DRUMMED THEY LEAPED AND BOUNDED IN MISSUS STRINGHAM'S TYPICAL ORGANISM THIS LADY STRIKING HIM AS BEFORE ALL THINGS EXCITED AS IN THE NATIVE PHRASE KEYED UP
1064,audio_01064.wav,கைவினை பொருட்களான இந்த சிப்பிகளை எடுத்து அலங்கார பொருட்கள் செய்கிறது
1821,audio_01821.wav,पीरियड्स शब्द का उच्चारण बिना झिझक के किया जा सकेगा
442,audio_00442.wav,or getting angry and clawing or gnawing.
359,audio_00359.wav,place nowadays it is natural for gun toting youths.
1945,audio_01945.wav,पहली बार जाते हैं तो काफ़ी कुछ जाना पहचाना सा लगता है
1991,audio_01991.wav,में आगे बढ़ सका
1333,audio_01333.wav,बी ने दो हज़ार पंद्रह के बाद से किसान आत्महत्याओं से जुड़े
1123,audio_01123.wav,AND COULD NOT FORGIVE HER HE SAID TO HER SOMEWHAT CRUELLY THAT HE WAS TIRED OF PAYING FOR THE FOLLIES OF A WOMAN WHO COULD NOT EVEN HAVE HIM TREATED WITH RESPECT UNDER HIS OWN ROOF AND HE WENT AWAY IN GREAT INDIGNATION
120,audio_00120.wav,BUT WOULD LET THEM NONE THE LESS IN JUSTICE TO THEIR GOOD WILL EXPRESS IT IN THEIR COARSER FASHION DENSHER HIMSELF WASN'T UNCONSCIOUS IN RESPECT TO THIS OF A CERTAIN BROAD BROTHERHOOD WITH MISSUS STRINGHAM WONDERING INDEED WHILE HE FOLLOWED THE TALK HOW
1164,audio_01164.wav,हत्या दो अक्टूबर को इस्तांबुल में सऊदी अरब के वाणिज्य दूतावास में
874,audio_00874.wav,HE HELD UP SOMETHING HE HAD IN HIS HAND SO THAT EVERY ONE COULD SEE IT WAS A STONE THERE COULD BE NO DOUBT ABOUT THAT WITH SOME OF THE SNOW STILL ADHERING TO ITS SIDES BLUFF RUBBED THE SIDE OF HIS HEAD AT SEEING THIS
1915,audio_01915.wav,जब हम साथ रहते थे तो हम अपनी बेटी की ज़िम्मेदारियों को
23,audio_00023.wav,fear of monkeys.
63,audio_00063.wav,i am so scared of the guns since i.
1334,audio_01334.wav,good i will hang up now you want.
1573,audio_01573.wav,அந்தமாதிரி வேலை பார்க்குறனாலையே அவர் தனியாக பிரிஞ்சு இருந்தார் அப்போ தான் தெரிஞ்சது பழமையாக பழங்குடியினரையும் பிரிச்சு தான் வச்சுருக்காங்க ஜாதி மற்றும் இனத்தால் வந்து இங்கே பிரிச்சு தான் இருக்கு மொழிகள் குழுக்கள்னால எல் மொழிகள்
