id,audio,text
1029,audio_01029.wav,IT CARRIED HIM BACK A DOZEN YEARS TO A DIRTY LITTLE PEASANT'S CABIN ON THE HILLSIDE OUTSIDE DURAZZO TO THE LIVID FACE OF A YOUNG ALBANIAN CHIEF WHO HAD LOST AT KARA'S WHIM ALL THAT LIFE HELD FOR A MAN
1976,audio_01976.wav,मैं अपनी दस साल की बेटी के साथ खड़ी उन तस्वीरों और
715,audio_00715.wav,உடனே உயிரைக் காப்பாத்துறமாதிரியான பல விஷயங்கள் அங்கே வச்சுருக்காங்க டாக்டர்ஸும் டேலெண்டட் அண்டு போலி டாக்டர்ஸ் கிடையாது
1593,audio_01593.wav,AFTER A BUTTERFLY OR A DRAGON FLY THIS COURTESAN WHO HAD COST MORE MONEY IN BOUQUETS THAN WOULD HAVE KEPT A WHOLE FAMILY IN COMFORT WOULD SOMETIMES SIT ON THE GRASS FOR AN HOUR EXAMINING THE SIMPLE FLOWER WHOSE NAME SHE BORE
154,audio_00154.wav,அவள் அவ செய்கிற சில விஷயங்கள் எனக்கும் நானும் செய்வேன் எனக்கு
1575,audio_01575.wav,AND THE TONE OF SOCIETY WENT SO FAR AS TO MAKE HIM TAKE UP AGAIN HIS SENSE OF INDEPENDENCE HE HAD SUPPOSED HIMSELF CIVILISED BUT IF THIS WAS CIVILISATION ONE COULD SMOKE ONE'S PIPE OUTSIDE WHEN TWADDLE WAS WITHIN
1362,audio_01362.wav,TAKE THEM ALL UP ON TRUST FURTHER ON HE MET IT PEACEFULLY A LITTLE PERHAPS AS AN EXAMPLE TO MISSUS STRINGHAM OH AS FAR ON AS YOU LIKE THIS EVEN HAD ITS EFFECT MISSUS STRINGHAM APPROPRIATED AS MUCH OF IT AS MIGHT BE MEANT FOR HERSELF
570,audio_00570.wav,உள்ளூர் கலைஞர்கள் எங்கள் மாநிலத்தோடய பாரம்பரிய கலைகளை பாதுகாக்க எடுக்கிற முயற்சிகள்ன்னு பார்த்திங்கன்னா நிறைய சொல்லலாம் இன்றைக்கி வரைக்கும் தெருக்கூத்து ஒயிலாட்டம் மயிலாட்டம் போன்ற சில கலைகள் இன்றைக்கி கிராமப்புற இடங்கள்ல வெகு சில இடங்களில் மட்டுமே பார்க்க முடியுது
1883,audio_01883.wav,i could do so within half an hour in.
912,audio_00912.wav,वह कहती हैं एक पुरुष के पास एक और बीवी रखने की
232,audio_00232.wav,a desire to stay on in america.
748,audio_00748.wav,இல்லை எல்லை பாதுகாப்பு படையினர் அந்த மாதிரி வந்து முன்கூட்டியே அவங்க வந்து கூட இருந்து இது இது எல்லை பகுதியாக
1834,audio_01834.wav,அவர்னஸ்ங்கிறது ரொம்ப முக்கியமான விஷயம் அதுவும் மருத்துவத்தில் சொல்லவா வேணும் பல உயிரை காப்பாத்தணுனால் அவர்னஸ் ரொம்ப ரொம்ப முக்கியம்
1367,audio_01367.wav,they hardly come.
675,audio_00675.wav,he fits two buckets of water and.
962,audio_00962.wav,वर्तमान से बेहतर होगा
838,audio_00838.wav,under his control.
416,audio_00416.wav,ஆனால் புக் புக் எக்ஸ்போ இங்கே கோயம்த்தூரில் எங்கேயாச்சி போட்டாங்க அப்படின்னா கண்டிப்பாக போகணுன்னு ஆசைப்படுறேன்
1522,audio_01522.wav,IF HE EXPECTED HER TO GIVE HIM ANY ENCOURAGEMENT TO PROCEED HE WAS DISAPPOINTED PROBABLY HE REQUIRED NO SUCH ENCOURAGEMENT FOR IN THE PRESENCE OF HIS SOCIAL INFERIORS HE WAS SOMEWHAT MONOPOLIZING CUT A MAN'S FLESH AND IT HEALS HE SAID
900,audio_00900.wav,हालांकि प्रजनन दर में कमी का फिलहाल ज़्यादा असर नहीं पड़ेगा
1407,audio_01407.wav,although i didnt show much anxiety while.
1248,audio_01248.wav,आपको सही तरीके से संबोधित करने की प्रिय मैडम मैडम प्रिय मिसेज़
449,audio_00449.wav,தொடர்ந்து இப்போ மாதாந்திர வாராந்திரனா வாரத்துக்கு ஒரு நாலு நாள் அஞ்சு நாள் அந்த மாதிரி படிப்பேன் அதுலேருந்து ஒரு ஆஃப்பனவர் ஒன்னவர் படிப்பேன்
444,audio_00444.wav,இதெல்லாம் வந்து நல்லபடியாக செஞ்சார் எங்களுடைய வீடு தொகுப்பு வீடு கட்டுனது அவரு இருந்த இதன் மூலியமாக தான் எங்களுக்கு தொகுப்பு வீடு கட்டி கொடுத்தாங்க அதே மாதிரி எங்கள் ஊரில் பாதர் பி என் கந்தசாமினு ஒருத்தர் இப்போ அது பஞ்சாயத்து தலைவராக இருந்தார்
1827,audio_01827.wav,that could not be shut properly.
846,audio_00846.wav,HE HADN'T PRETENDED HE DID BUT THERE WAS A PURITY OF REPROACH IN MISSUS STRINGHAM'S FACE AND TONE A PURITY CHARGED APPARENTLY WITH SOLEMN MEANINGS SO THAT FOR A LITTLE SMALL AS HAD BEEN HIS CLAIM HE COULDN'T BUT FEEL THAT SHE EXAGGERATED
1856,audio_01856.wav,icy winds also blow from there.
269,audio_00269.wav,but a everything has a limit.
1828,audio_01828.wav,फ़लस्तीन में यूएन के अधिकारियों के मुताबिक इनमें से ज़्यादातर आम नागरिक
1192,audio_01192.wav,out tomorrow how can i remain indoors.
1156,audio_01156.wav,the well with an indication of his finger.
1554,audio_01554.wav,சுவாசிக்கிறத்துலையும் நமக்கு கொஞ்சம் ஹெல்ப்ஃபுல்லாக இருக்குன்னு வச்சிக்கிலாம் அது எப்படின்னு பார்த்தீங்கன்னா
1470,audio_01470.wav,किरदारों और उन कहानियों को वाकई छोड़ पाता है जिसे कुछ ही
99,audio_00099.wav,को उठाती तो रही लेकिन उसका असर हुआ हो ऐसा नहीं लगता
586,audio_00586.wav,he is balen i have told you about him.
38,audio_00038.wav,I'M BEGINNING TO BELIEVE WILL WAS NOT SO FAR OUT OF THE WAY AFTER ALL WHEN HE SAID IT MIGHT BE THE GIANT OF ALL MAINE MOOSE BLUFF GOT UP AGAIN SHAKING HIS HEAD OH THE MEANEST LUCK THAT EVER WAS HE LAMENTED
155,audio_00155.wav,उस पर नियंत्रण है
471,audio_00471.wav,i am an only son.
43,audio_00043.wav,लेकिन भारतीय टीम भी ख़ाली हाथ नहीं है
1927,audio_01927.wav,लेकिन दोनों के बीच प्यार परवान चढ़ता गया इस प्यार के चलते
1154,audio_01154.wav,get married and then move to guwahati.
1783,audio_01783.wav,by the ranger at his bungalow and the remaining.
1425,audio_01425.wav,first i stopped at chicago.
1525,audio_01525.wav,उनके लापता होने के बाद अख़बार ने शुक्रवार को उनके कॉलम की
316,audio_00316.wav,எந்த விஷயத்திற்கு எந்த தமிழை பயன்படுத்த வேண்டும் அப்டின்றதை வந்து இந்த ஒவ்வொரு தமிழ்லையும் வந்து வரையறுத்து வச்சிருப்பாங்க
1479,audio_01479.wav,in africa not be hen pecked.
1221,audio_01221.wav,AND I THINK I EVEN SAW A SQUIRREL FRISK OUT OF SIGHT AS WE CAME UP YES AND HERE'S WHERE WILL MADE HIMSELF A SEAT ADDED BLUFF HE FIXED IT SO HE COULD SIT COMFORTABLY AND NOT HAVE TO FRIGHTEN THE FAMILY OF BUSHY TAILS BY MOVING
1916,audio_01916.wav,AND I HAD COME TO LIVE ENTIRELY AT HER HOUSE THE SERVANTS ADDRESSED ME OFFICIALLY AS THEIR MASTER PRUDENCE HAD STRICTLY SERMONIZED MARGUERITE IN REGARD TO HER NEW MANNER OF LIFE BUT SHE HAD REPLIED THAT SHE LOVED ME THAT SHE COULD NOT LIVE WITHOUT ME
171,audio_00171.wav,आदर्श उदाहरण बताया है
1232,audio_01232.wav,what do you mean.
1354,audio_01354.wav,BLUFF CAUGHT HIM BY THE ARM WAIT JUST A MINUTE OR TWO WILL HE PLEADED TELL US SOME MORE WHERE DID ALL THIS HAPPEN FRANK KNOWS WHERE THAT SQUIRREL COLONY HAVE THEIR NEST IN THE TREE THAT'S GOT A HOLE IN THE TRUNK ABOUT THIRTY FEET UP THE OTHER REPLIED
1463,audio_01463.wav,IN WHICH WERE THOUSANDS OF FISHES FOUR OR FIVE INCHES LONG SOME OF WHICH COVERED ROOFS OF HOUSES AND SOME OF WHICH REMAINED TEN MINUTES IN THE AIR BY WAY OF CONTRAST WE OFFER OUR OWN ACCEPTANCE THAT THE BOTTOM OF A SUPER GEOGRAPHICAL POND HAD DROPPED OUT
138,audio_00138.wav,वह अपने बेटे और सबके लिए भयावह था
1145,audio_01145.wav,ரொம்ப வேஸ்டாய்ஜா ஆகிருச்சி சோபா செட்டு அதிக காசு கொடுத்து வாங்கி வேஸ்டேஜாக இருக்குது
1515,audio_01515.wav,but a strong desire to hear out.
1663,audio_01663.wav,THE LONG DAYLIGHT THE POSTPONED LAMPS THE HABIT OF THE HOUR MADE DINNERS LATE AND GUESTS STILL LATER SO THAT PUNCTUAL AS HE WAS HE HAD FOUND MISSUS LOWDER ALONE WITH KATE HERSELF NOT YET IN THE FIELD
1137,audio_01137.wav,டிராவலிங் பண்ணும் போது நம்மளுக்கு மைலேஜ் வந்து இவ்வளோ தருதுன்னா அது வந்து ஹோண்டா சொல்லுவேன் ஹோண்டா கம்பெனி ஹோண்டா பைக்கு சொல்லுவேன் ரொம்ப மைலேஜ் தரும் எனக்கு வந்து மை டிரீம் பைக்குன்னா கேடிஎம் டுயூக்கு எனக்கு ரொம்ப பிடிக்கும் சின்ன வயசுலேருந்து ரொம்ப ஆசைப்பட்டேன்
130,audio_00130.wav,அது மட்டும் ஆக
411,audio_00411.wav,बाद में यह अंग्रेज़ों द्वारा शासित राज बना
132,audio_00132.wav,ASKING FOR A NOTE FOR A THOUSAND FRANCS PROFESSEDLY ON BEHALF OF MARGUERITE YOU KNOW I HAD WON SOME MONEY AT GAMBLING I THEREFORE IMMEDIATELY HANDED OVER TO PRUDENCE WHAT SHE ASKED FOR MARGUERITE
1516,audio_01516.wav,शक्तिशाली देशों तक को नहीं लगी थी
753,audio_00753.wav,i will give news from assam.
816,audio_00816.wav,इसे बंद कर दिया गया
913,audio_00913.wav,लक्ष्मी माता प्रकाश धन और सौंदर्य की देवी हैं
1161,audio_01161.wav,balen had in the meanwhile.
473,audio_00473.wav,AND IF HE DOES IT WILL NOT BE THE REWARD OF A HUNDRED DOLLARS FOR INFORMATION THAT WILL MAKE HIM TELL ON THE SECOND DAY ABOUT NOON SOME OF THE BOYS WERE BUSY NEAR THE CABIN LAYING IN AN EXTRA SUPPLY OF FIREWOOD
72,audio_00072.wav,he was not expecting such a vague and indifferent.
398,audio_00398.wav,வந்து டிரைவர் வந்து ஒரு நல்ல டிரைவராக இருக்கணும் டிரைவர் நல்ல டிரைவரானா வயசான ஆள் தேவை இல்லை நார்மல் ஏஜில் உள்ளவங்க இருக்கணும் ஏன்னால் வயதான ஆள் வந்து கண்ணு முழிச்சு ஓட்டுவாங்களா என்னன்னு தெரியல நைட் நேரமும் ட்ராவல் இருக்கும் ஏன்னால் நாங்கள் வந்து போவது சுற்றி பார்க்குறதுக்காக தான் போகிறோம் ஊட்டி
1483,audio_01483.wav,prabal i am really finding it cold here.
1772,audio_01772.wav,के साथ भारत अपना संबंध अमरीकी चश्मे से नहीं देख सकता
150,audio_00150.wav,அந்த மாதிரிதான் சூழ்நிலை இருக்குது அப்போ அப்படி இருக்கும்போது நீங்கள் வந்து இந்த மாதிரி தரமில்லாத உணவுகளை செஞ்சு கொடுத்தீங்கனா உங்கள் வியாபாரமும் பாதிக்கும் ரெகுலராக வர்ற கஸ்டமர்களும் வேறு கடைக்கு இங்கே உங்களை விட நல்லவிதமாக தரமான சாப்பாடு எங்கே செஞ்சு தர்றாங்களோ அத அந்த கடையை தொழாவி போயிடுவாங்க உங்கள் வியாபாரமும் கெட்டு போயிடும்
1512,audio_01512.wav,because besides me there was no one else.
1497,audio_01497.wav,very easy for him to prepare.
1474,audio_01474.wav,நான் எதனா வந்துட்டு தப்பாக சொல்லியிருந்தா என்னை மன்னிச்சுடுங்க ஆனால் வந்துட்டு இனிமேல் யாரை கூப்பிட்டாலுமே கரெக்ட் டைமுக்கு போய் அவங்கள கொண்டு போய் விட்டுருங்க ஏன்னால் அவங்களுக்கு அதுவே வாழ்க்கையாக கூட அமையலாம் சரிங்களா அண்ணா ஓகே அண்ணா
1769,audio_01769.wav,ஏழு ஒன்று மூன்று ஒன்பது ஒன்று ஒன்பது ஆறு மூன்று ஒன்பது நான்கு ஆறு என்ற தொடர்பு எண் என்னுடைய ஜியோ மனி கணக்கில் உள்ளதா
920,audio_00920.wav,NOW SO FULLY PLACED BEFORE THEM THAT MILLY'S ANXIOUS COMPANION SAT AND LOOKED LOOKED VERY MUCH AS SOME SPECTATOR IN AN OLD TIME CIRCUS MIGHT HAVE WATCHED THE ODDITY OF A CHRISTIAN MAIDEN IN THE ARENA MILDLY CARESSINGLY MARTYRED
1113,audio_01113.wav,ஏ சா சாமந்திப்பூ அப்புறம் இந்த சா சாமந்திப்பூ இந்த நித்தி நித்திய நந் நந்திவட்ட பூவுன்னு சொல்லுவாங்க நந்திவட்ட பூ வந்து மிகவும் சிறப்பானது கண்ணுக்கு வச்சா அவ்வளவு ஒரு அற்புதமான ஒரு நந்தியாவட்ட பூ
1549,audio_01549.wav,BUT WHILE DOING SO HE DEFENDED HIMSELF I CERTAINLY DON'T KNOW ENORMOUSLY MUCH BEYOND HER HAVING BEEN MOST KIND TO ME IN NEW YORK AS A POOR BEWILDERED AND NEWLY LANDED ALIEN
82,audio_00082.wav,was known to me.
1343,audio_01343.wav,THE EDITOR SAYS THAT ONE WAS A MINNOW AND THAT THE REST WERE STICKLEBACKS HE SAYS THAT DOCTOR GRAY'S EXPLANATION IS NO DOUBT RIGHT BUT
1464,audio_01464.wav,मैंने जूते पहने थे मैं थूक रही थी
802,audio_00802.wav,you wont be able to catch the bus.
972,audio_00972.wav,otherwise judiths food will get stone cold.
886,audio_00886.wav,wanted to run away from the place.
577,audio_00577.wav,when i change who nods when i nod.
1441,audio_01441.wav,இந்த வெளிலிருந்து கரூர் டெக்டைல்ஸ்லெலாம் வந்து போய்விட்டு வந்தாங்களாம் அவர்களுக்குலாம் வேலை இல்லைன்னு சொல்லி கம்பெனீஸெலாம் மூடும் போது அவங்க ரொம்ப சாப்பாட்டுக்கெலாம் கஷ்டப்பட்டாங்கன்னு வைச்சுக்குங்களேன் இதிலேருந்து நான் என்னத்தை தெரிவிச்சுக்கிறேனா அடிப்படையிங்கிறம்போது அந்த செயலை வந்து நம்ம வந்து ஸ்டாப் பண்ணக் கூடாது இல்லை
189,audio_00189.wav,लेकिन उन्होंने इस बात से इनकार किया कि इसमें सऊदी अरब के
1024,audio_01024.wav,ऐसा हो ये ज़रूरी नहीं
151,audio_00151.wav,anyway during that quarrel.
782,audio_00782.wav,ஒவ்வொரு வீட்டுக்கும் இந்தமாதிரி அது சதுரடியிலெலாம் உங்களுக்கு நிலம் இருந்தால் உங்களுக்கு கவர்மெண்ட்டில் அலாட்மெண்டில் வீடு வந்திருக்கு அப்படினு சொல்லி
1920,audio_01920.wav,एक हज़ार नौ सौ अड़तालीस में इसराइल के गठन के बाद से
1552,audio_01552.wav,பெரிய ஒரு ஏமாற்றம் சார் இந்த மாதிரி இருந்தால் நான் கண்டிப்பாக வந்து ரேட்டிங்கும் கம்மியாகதான் சார் கொடுப்பேன் அது மாதிரி டெலிவரி பாய் வந்து ரொம்ப லேட் பண்ணிவிட்டாங்க
789,audio_00789.wav,AND FOR WHOM ELSE SHOULD I BURY MYSELF HERE IF NOT FOR YOU WELL THEN MARGUERITE LET ME TAKE IT MYSELF YOU ARE MAD NOT ONLY IS IT UNNECESSARY BUT IT WOULD BE DANGEROUS
257,audio_00257.wav,நிறைய வெளியூர்ல இருந்து பக்தர்கள் வந்து வைகுண்ட ஏகாதசியை ரங்கநாதரை வந்து தரிசிச்சிட்டு போவாங்க அதேமாதிரி
1668,audio_01668.wav,सैटेलाइट इतना बड़ा है कि इसका हर सोलर पैनल चार मीटर से
451,audio_00451.wav,विकास अग्रवाल तंज कसते हुए फ़ेसबुक पर एक लंबी पोस्ट लिखते हैं
1322,audio_01322.wav,இருந்தாலும் இப்போ உள்ள ஜென்ரேஷன் வந்து கொஞ்சம் தேவலாம் முன்ன இருந்ததுக்கு ஆனால் வந்து நாகப்பட்டினம் மாவட்டத்தில் உள்ள இந்த முக்கிய இனம் மற்றும் மொழிகள்குழுகள்ல வந்து எவைன்னா அந்த மொழி மற்றும் இனம் மற்றும் குழுக்களை வந்து வெள்ல சொல்லக்கூடாதுன்னு சொல்லிட்டு
1539,audio_01539.wav,पांच बिलियन डॉलर की भारतीय सेना के लिए एंटी टैंक मिसाइल और
1621,audio_01621.wav,எனது வாழ்க்கையில் வந்து ஏற்பட்ட தொழில்நுட்ப மாற்றம் ரொம்ப என்னென்னா நான் வந்து கொரோனா காலத்தில் வந்து இந்த தொழிலெலாம் ரொம்ப முடக்கம் பண்ணாங்கள்லே
414,audio_00414.wav,why are parties not held now a days surely bhabaprasad.
1517,audio_01517.wav,அவர் பாலிவுட்டு டோலிவுட் தமிழ்நாடு ஃபுல்லாக அவர் இருக்கார் பிரபுதேவாவோட டான்ஸ் எங்கே பார்த்தாலுமே இருக்கு
1849,audio_01849.wav,உள்ளூர் சடங்கு எப்படின்னா எப்புடின்னா எங்கள் ஊரில் வந்து காமாட்சி அம்மன் வீர வீர சாமி எப்புடின்னு ரெண்டு பேர்ருக்காங்க அதை சுற்றி சங்குலி கருப்பன் எல்லா சாமியும் இருக்காங்க
820,audio_00820.wav,नीति और राजनीति में कर्म प्रधान है
7,audio_00007.wav,you had mentioned over the phone.
1592,audio_01592.wav,WEAR YOUR SWEATERS AND BE SURE YOUR WOOLEN GLOVES ARE IN YOUR POCKETS CAUTIONED WEATHER WISE FRANK HE HOVERED ABOUT THE PAIR AND CONSTANTLY WARNED THEM AGAINST CARELESSNESS I HOPE YOU GET THAT BIG MOOSE HE TOLD THEM AS THEY ALL PUSHED OUTDOORS
1395,audio_01395.wav,MY FATHER WAS AND STILL IS RECEVEUR GENERAL AT C HE HAS A GREAT REPUTATION THERE FOR LOYALTY THANKS TO WHICH HE WAS ABLE TO FIND THE SECURITY WHICH HE NEEDED IN ORDER TO ATTAIN THIS POSITION
1569,audio_01569.wav,इस गांव में नौ बैंकों की शाखाएं हैं और दर्जनों एटीएम लगे
956,audio_00956.wav,இந்த வருஷம் நான் தமிழ்நாடு வந்துவிட்டு மருத்துமனைகள் அந்த அளவுக்கு அட்வான்ஸுன்னு சொல்ல மாட்டேன் ஆனால் பொறுமையாக போக போக போக இந்த மருத்துமனைகள் வந்துவிட்டு நல்ல அட்வான்ஸுடு கண்டிஷனுக்கு இப்போ போயிகிட்டேதான் இருக்காங்க நல்ல இம்புருமெண்ட்டும் காமிக்கிறாங்க
1045,audio_01045.wav,like prabal they however had a piping hot meal.
83,audio_00083.wav,நீங்கள் எதிர்பார்க்குற கேஷை நாங்கள் கரெக்டாக கொடுத்துடுவோம் அந்தமாதிரி எங்களுக்கு ஏதாச்சும் சேட்டிஸ்ஃபைடாக இல்லைனா கேஷ் கம்மியாக தான் கொடுப்போம் நான் இப்போவே சொல்லிக்கிறேன் கார் நாங்கள் கேட்டமாதிரி கார்
924,audio_00924.wav,i said as i changed my clothes.
1119,audio_01119.wav,அவரு வந்து ஒரு ஆக்சிடன்ட்ல வந்து இறந்துட்டாரு அவர் மூலியமாகவும்
582,audio_00582.wav,मेरी माँ कहती थी कि पढ़ने लिखने से दुनिया बदल जाती है
1690,audio_01690.wav,along with it bhabaprasad reentered the room.
165,audio_00165.wav,ஆயிரத்தி தொள்ளாயிரத்தி அறுபத்தி ஏழு முப்பத்தி மூணாயிரத்தி முந்நூற்றி முப்பத்தி மூணு நாலு லட்சத்தி எண்பத்தாறாயிரத்தி எழுநூற்றி அறுபத்தி ஒன்று முப்பத்தியெட்டு நாற்பத்தஞ்சாயிரத்தி தொள்ளாயிரம்
792,audio_00792.wav,IN THE REGION OF INERTNESS THAT WE THINK WE CAN CONCEIVE OF OR A ZONE THAT IS TO THIS EARTH'S GRAVITATION VERY MUCH LIKE THE NEUTRAL ZONE OF A MAGNET'S ATTRACTION WE ACCEPT THAT THERE ARE BODIES OF WATER AND ALSO CLEAR SPACES BOTTOMS OF PONDS DROPPING OUT
1848,audio_01848.wav,அதுக்கூட இந்த கோதுமை ரவையோ இல்லாட்டி அரிசி சாப்பாடோ ஏதோ ஒன்று போட்டு களியாகவும் செஞ்சு அதுக்கு உண்டான என்ன
